<?xml version="1.0" encoding="UTF-8"?>
<dataroot xmlns:od="urn:schemas-microsoft-com:officedata" xmlns:xsi="http://www.w3.org/2001/XMLSchema-instance"  xsi:noNamespaceSchemaLocation="CT_ORIGEN_VENTA.xsd" generated="2009-12-29T17:24:31">
<CT_ORIGEN_VENTA>
<idOrigenVenta>1</idOrigenVenta>
<DescripcionOrigenVenta>VENTA</DescripcionOrigenVenta>
<Grupo>VENTA</Grupo>
<EsVenta>S</EsVenta>
<SinCosto>N</SinCosto>
<FechaInicial>2009-12-01T00:00:00</FechaInicial>
<FechaFinal>2010-12-31T00:00:00</FechaFinal>
</CT_ORIGEN_VENTA>
<CT_ORIGEN_VENTA>
<idOrigenVenta>2</idOrigenVenta>
<DescripcionOrigenVenta>TRASPASO</DescripcionOrigenVenta>
<Grupo>TRASPASO</Grupo>
<EsVenta>N</EsVenta>
<SinCosto>S</SinCosto>
<FechaInicial>2009-12-01T00:00:00</FechaInicial>
<FechaFinal>2010-12-31T00:00:00</FechaFinal>
</CT_ORIGEN_VENTA>
<CT_ORIGEN_VENTA>
<idOrigenVenta>3</idOrigenVenta>
<DescripcionOrigenVenta>CORTESIA</DescripcionOrigenVenta>
<Grupo>CORTESIA</Grupo>
<EsVenta>N</EsVenta>
<SinCosto>S</SinCosto>
<FechaInicial>2009-12-01T00:00:00</FechaInicial>
<FechaFinal>2010-12-31T00:00:00</FechaFinal>
</CT_ORIGEN_VENTA>
<CT_ORIGEN_VENTA>
<idOrigenVenta>4</idOrigenVenta>
<DescripcionOrigenVenta>INTERCAMBIO</DescripcionOrigenVenta>
<Grupo>INTERCAMBIO</Grupo>
<EsVenta>N</EsVenta>
<SinCosto>S</SinCosto>
<FechaInicial>2009-12-01T00:00:00</FechaInicial>
<FechaFinal>2010-12-31T00:00:00</FechaFinal>
</CT_ORIGEN_VENTA>
<CT_ORIGEN_VENTA>
<idOrigenVenta>5</idOrigenVenta>
<DescripcionOrigenVenta>STAFF</DescripcionOrigenVenta>
<Grupo>STAFF</Grupo>
<EsVenta>N</EsVenta>
<SinCosto>S</SinCosto>
<FechaInicial>2009-12-01T00:00:00</FechaInicial>
<FechaFinal>2010-12-31T00:00:00</FechaFinal>
</CT_ORIGEN_VENTA>
<CT_ORIGEN_VENTA>
<idOrigenVenta>6</idOrigenVenta>
<DescripcionOrigenVenta>SISTEMA</DescripcionOrigenVenta>
<Grupo>SISTEMA</Grupo>
<EsVenta>N</EsVenta>
<SinCosto>S</SinCosto>
<FechaInicial>2009-12-01T00:00:00</FechaInicial>
<FechaFinal>2010-12-31T00:00:00</FechaFinal>
</CT_ORIGEN_VENTA>
</dataroot>
